id,uuid,name,category,equipment,muscles_primary,muscles_secondary,license,description_html
376,c2078aac-e4e2-4103-a845-6252a3eb795e,Leg Raise,Legs,,Obliquus externus abdominis; Abs,,CC0,"The leg raise is a strength training exercise which targets the iliopsoas (the anterior hip flexors). Because the abdominal muscles are used isometrically to stabilize the body during the motion, leg raises are also often used to strengthen the rectus abdominis muscle and the internal and external oblique muscles."
394,a7e6c20a-6ddc-4401-9935-ace2d02e3995,Long-Pulley (low Row),Back,,Lats,Biceps; Brachialis,CC-BY-SA 3,"Sit down, put your feet on the supporting points and grab the bar with a wide grip. Pull the weight with a rapid movement towards your belly button, not upper. Keep your arms and elbows during the movement close to your body. Your shoulders are pulled together. Let the weight slowly down till your arms are completely stretched."
397,183e7279-f052-4c70-8381-bbbda3bb9afe,Low Box Squat - Wide Stance,Legs,Barbell,Glutes; Quads,,CC-BY-SA 4,"<p>Unrack the bar and set your stance wide, beyond your hips.  Push your hips back and sit down to a box that takes you below parallel.  Sit completely down, do not touch and go.  Then explosively stand up.  Stay tight in your upper back and torso throughout the movement.</p>"
406,aa3b4ebe-6dee-45ad-a345-cf2acebf4159,Lying Rotator Cuff Exercise,Shoulders,Dumbbell,,,CC-BY-SA 4,"<p>This is an excercise for problems with the levator muscles. Primary  Infraspinatus, secondary Teres Minor.</p>
<p>Lying on side. Keep elbow on waist and in 90 dgr angle. Rotate towards stomach. Add weight as fit.</p>"
367,49189e88-40b6-4c0d-a784-0cc3abbb8e75,Leg Curls (standing),Legs,,Hamstrings,,CC-BY-SA 3,
375,18104387-4567-4c1e-8d03-db0b274646dd,Leg Press on Hackenschmidt Machine,Legs,,Quads,,CC-BY-SA 3,
373,5f0b757c-0d6a-430b-9d5e-3bfba202878e,Leg Presses (narrow),Legs,,Quads,Glutes,CC-BY-SA 3,"<p>The exercise is very similar to the wide leg press:</p>
<p>Sit on the machine and put your feet on the platform so far apart  that you could just put another foot in between them. The feet are parallel and point up.</p>
<p>Lower the weight so much, that the knees form a right angle. Push immediately the platform up again, without any pause. When in the lower position, the knees point a bit outwards and the movement should be always fluid.</p>"
374,661287d4-d1dc-485c-896b-73f90b000536,Leg Presses (wide),Legs,,Quads,Glutes,CC-BY-SA 3,"<p>Sit on the machine and put your feet on the platform, a bit more than shoulder wide. The feet are turned outwards by a few degrees.</p>
<p>Lower the weight so much, that the knees form a right angle. Push immediately the platform up again, without any pause. When in the lower position, the knees point a bit outwards and the movement should be always fluid.</p>"
371,66a42396-c207-44da-bc75-758a89d32404,Leg Press,Legs,,Hamstrings; Calves; Glutes; Quads,Calves; Glutes,CC0,The leg press is a weight training exercise in which the individual pushes a weight or resistance away from them using their legs.
423,0027b172-a83e-4f79-af47-483302a22c02,Muscle up,Back,Pull-up bar,Biceps; Hamstrings,,CC-BY-SA 4,"<p>The body is then explosively pulled up by the arms in a radial pull-up, with greater speed than a regular pull-up. When the bar approaches the upper chest, the wrists are swiftly flexed to bring the forearms above the bar. The body is leaned forward, and the elbows are straightened by activating the triceps. The routine is considered complete when the bar is at the level of the waist and the arms are fully straight.</p>
<p>To dismount, the arms are bent at the elbow, and the body is lowered to the floor, and the exercise can be repeated.</p>
<p>As a relatively advanced exercise, muscle-ups are typically first learned with an assistive kip. The legs swing (kip) up and provide momentum to assist in the explosive upward force needed to ascend above the bar. More advanced athletes can perform a strict variation of the muscle-up which is done slowly, without any kip. This variation begins with a still dead hang and uses isometric muscle contraction to ascend above the bar in a slow, controlled fashion.</p>"
382,16089e03-5afc-4a18-a40a-beb337806ac0,L Hold,Abs,,,,CC-BY-SA 3,<p>Hold the L position for as long as possible</p>
448,748e9635-7958-4a41-b1ed-93de74c7ef72,Pendelay Rows,Back,Barbell,Lats; Trapezius,Biceps; Triceps,CC-BY-SA 3,<p>Back excercise with a barbell with a starting position which is in a bent over position with the back paralell to the ground. The barbell is on the ground at chest level.For the movement grab the barbell at shoulder width grip and pull towards your chest without losing the bent over position and without moving anything but your arms</p>
484,a6c2a970-a621-4e03-be1d-4a29118b1687,Rack Deadlift,Back,,Glutes,Biceps,CC-BY-SA 3,"<p>Deadlift to be done using a Smith machine or a free rack. Bar or barbell hould be just right under the knee cap level. Lift using the glutes and through the heels, then come back to starting postion with a control movement of 2 seconds.</p>
<p>This exercise targets mainly the lower back and glutes.</p>"
478,4284336c-6cfa-4c4d-a440-26b30db035d1,Push Press,Shoulders,,Trapezius,Glutes,CC-BY-SA 3,"<p>Clean your dumbbells onto your shoulders, palms facing in. Take a breath and brace your core.&nbsp;(picture 1)<b>&nbsp;</b>Dip at the knees and use your legs to help&nbsp;(picture 2)&nbsp;press your dumbbells overhead. Lower under control with a slow tempo to your shoulders and repeat.</p>"
445,6441ff9e-037e-48d9-8800-67b430dc8e37,Pause Bench,Chest,Barbell; Bench,Chest,Triceps,CC0,"<p>Lower the bar to your chest and pause (but do not rest) there for 2 seconds. Press back up. use the same weight you would on bench press, but perform only single reps. Total the number of reps you did in one set of bench press (if you did 3 sets of 8 do 8 sinlge pause bench reps.</p>"
465,dd52fb99-9426-4a78-b446-20a8e3e4ec47,Preacher Curls,Arms,SZ-Bar,Brachialis,Brachialis,CC-BY-SA 3,<p> Place the EZ curl bar on the rest handles in front of the preacher bench. Lean over the bench and grab the EZ curl bar with palms up. Sit down on the preacher bench seat so your upper arms rest on top of the pad and your chest is pressed against the pad. Lower the weight until your elbows are extended and arms are straight. Bring the weights back up to the starting point by contracting biceps. Repeat</p>
468,9cb69afc-7a44-4a22-b9a9-7bde8aca5b11,Prone Scapular Retraction - Arms at Side,Back,,Trapezius,,CC-BY-SA 4,"<p>Lying on stomach with head on towel.</p>
<p>Stretch arms straight out to your sides.</p>
<p>Slowly lift your arms, pulling your shoulderblades together, hold for 3 seconds.</p>
<p> </p>"
454,3b96a05b-9705-48da-b43e-6e098234bb35,Pike Push Ups,Arms,none (bodyweight exercise),Chest,Triceps,CC-BY-SA 4,<p>Push Up performed from a pike position (optional to have feet elevated).</p>
487,3f93459a-d06e-465c-85db-2137da759440,Rear Delt Raises,Shoulders,Dumbbell,,,CC-BY-SA 3,"<p>Seated on a bench bWith the dumbbells on the floor bend over at 45 Degrees and then slowly raise each dumbbell to shoulder height and hold for a couple seconds before lowering to the starting position. </p>
<p> </p>"
456,fe04cf35-1af5-4b51-89d4-c38d7eaa0db1,Pistol Squat,Legs,,Hamstrings; Glutes,Shoulders; Biceps; Brachialis,CC-BY-SA 3,"<ol><li>Stand with feet hip-width apart, toes pointed forward, and chest tall.</li><li>Extend your leg straight out; extend both arms in front of you, at shoulder level. Brace your core and look straight ahead.</li><li>Slowly squat down.&nbsp;</li><li>(optional) pause at the bottom.&nbsp;</li></ol>
Keep your (free) leg and arms extended for the whole duration."
477,7f834f07-fa7b-46b6-8ffa-45930b0602db,Pull Ups on Machine,Back,,Lats,Shoulders; Biceps; Trapezius,CC-BY-SA 3,
918,6d010eae-2e36-4ec6-b191-c0373f237bb4,Seated Dumbbell Side Lateral,Shoulders,Dumbbell,Shoulders,,CC-BY-SA 4,seated slightly leaned forward at beginning of exercise
475,8e420408-0682-4ab6-89f5-2681e54c7ce0,Pull-ups,Back,Pull-up bar,Lats,Shoulders; Biceps; Trapezius,CC-BY-SA 3,"<p>Grab the pull up bar with a wide grip, the body is hanging freely. Keep your chest out and pull yourself up till your chin reaches the bar or it touches your neck, if you want to pull behind you. Go with a slow and controlled movement down, always keeping the chest out.</p>"
439,c7058ff8-ca3b-4822-abdb-6341ce37c4d1,Overhand Cable Curl,Abs,,Biceps,,CC-BY-SA 3,"<p>Hands at shoulder height, curl arms in toward head, then back out.</p>"
458,c9e57bbe-e839-44c6-861d-1c8dd2845e36,Plank,Abs,none (bodyweight exercise),Obliquus externus abdominis; Abs,Biceps; Quads; Triceps,CC-BY-SA 3,"<p>Get into a position on the floor supporting your weight on your forearms and toes. Arms are bent and directly below the shoulder.&nbsp;</p>
<p>Keep your body straight at all times and hold this position as long as possible. To increase difficulty an arm or leg can be raised while performing this exercise.</p>"
545,e28b0685-7a8f-4343-9c0b-63b38386d30b,Scissors,Abs,,Abs,,CC-BY-SA 4,"<p>Scissors is an abdominal exercise that strengthens the transverse abdominals, helping flatten your belly and strengthen your entire core. Scissors is not only a core strength move, but it is also a great stretch for your hamstrings and your lower back. Everyone is looking for new ways to work the core, to flatten the belly and to improve flexibility. If you learn how to do Scissors you will get everything rolled together in one move.</p>"
495,2cd5e3c6-a8c0-456a-ab47-5e7b3a435407,Reverse Curl,Arms,Barbell; Dumbbell,Biceps; Brachialis,Biceps,CC0,The reverse-grip barbell curl is a variation on the biceps curl where the palms face downward. The switch from an underhand to an overhand grip brings the forearm and brachialis muscles more into the exercise.
512,00fcf603-b0d0-48d2-9b5e-c7f0d510d46c,"Rowing, Seated",Back,,Lats,,CC-BY-SA 3,
493,834c639f-4c82-404d-909f-4c75275465a0,Reverse Bar Curl,Arms,SZ-Bar,Biceps,,CC-BY-SA 3,"<p>Hold bar with reverse (or ""overhand"") grip, palms facing the floor.</p>"
490,2b6c09f7-dbf1-45ea-baf6-9a12e0b12396,Renegade Row,Back,Dumbbell,Lats; Trapezius,,CC0,"<p>Get into pushup position gripping some dumbbells. Perform one pushup, then drive your left elbo up, bringing the dumbell up to your body. Return the dumbell to starting position. </p>
<p>Perform another pushup and then row with the other arm to complete one rep.</p>"
513,32c129f7-cc28-4ebc-8465-e4fa62e220b1,"Rowing, T-bar",Back,,Lats,Shoulders; Biceps; Brachialis,CC-BY-SA 3,"<p>The execution of this exercise is very similar to the regular bent over rowing, only that the bar is fixed here.</p>
<p>Grab the barbell with a wide grip (slightly more than shoulder wide) and lean forward. Your upper body is not quite parallel to the floor, but forms a slight angle. The chest's out during the whole exercise. Pull now the barbell with a fast movement towards your belly button, not further up. Go slowly down to the initial position. Don't swing with your body and keep your arms next to your body.</p>"
549,cc5bf1a3-29b5-4c5a-8600-5e35c79ab4bf,Seated Triceps Press,Arms,Bench; Dumbbell,Triceps,,CC-BY-SA 4,"<p>Sit down on a back (better with back support). Take a dumbbell firmly with both hands and hold it with extended arms over your head. With your palms facing upward and holding the weight of the dumbbell, slowly lower the weight behind your head.</p>
<p> </p>"
919,1eeccede-29c5-4f38-9ba7-d77c7c47993d,T-Bar row,Back,Barbell,Lats; Trapezius,,CC-BY-SA 4,"bent over with triangle grip, slightly bent knees"
508,4b7cb037-0789-4014-ab6f-a451716b7538,Row,Back,Barbell; Dumbbell; Pull-up bar,Lats; Trapezius,Quads,CC0,"In strength training, rowing (or a row, usually preceded by a qualifying adjective — for instance a seated row) is an exercise where the purpose is to strengthen the muscles that draw the rower's arms toward the body (latissimus dorsi) as well as those that retract the scapulae (trapezius and rhomboids) and those that support the spine (erector spinae). When done on a rowing machine, rowing also exercises muscles that extend and support the legs (quadriceps and thigh muscles). In all cases, the abdominal and lower back muscles must be used in order to support the body and prevent back injury."
516,58416166-7a3a-470d-b493-27332799dcdf,Front Wood Chop,Back,,,,CC-BY-SA 4,
510,88dbcc74-0304-4fcf-8a47-92d14a484b0a,"Rowing, Lying on Bench",Back,,Lats,,CC-BY-SA 3,
501,7671b16c-5023-4663-b00d-86dd018e024f,Ring Dips,Arms,,Triceps,,CC-BY-SA 4,<p>Dips peformed on gymnastic rings.</p>
525,d9e306b6-d6ff-4e61-b283-4b085d8edaaf,Bent Over Rowing Reverse,Back,Barbell,Lats,Shoulders; Biceps,CC-BY-SA 3,
507,2e7ffff9-e603-4b28-98c8-31d1a6ce8cd9,Romanian Deadlift,Legs,Barbell,,,CC-BY-SA 4,<p>DL from top to pos 2: https://www.youtube.com/watch?v=WtWtjViRsKo</p>
505,af2f774c-296c-4d14-8e4a-fad77175ae37,Roman Chair,Abs,,,,CC-BY-SA 3,<p>Crunches on roman chair</p>
543,5912d7ed-6a0e-4b4c-b30a-fc9f3f890fc1,"Shoulder Press, on Machine",Shoulders,,Shoulders,Triceps,CC-BY-SA 3,
498,1b95d961-1d5c-4ded-b25e-c090295ffe37,Reverse Grip Bench Press,Chest,Barbell; Bench,Chest; Triceps,Shoulders,CC-BY-SA 4,<p>Upper chest focuses exercise that also works triceps</p>
529,6cf55ecc-86ee-492d-a7f6-977bf61758b3,Run - Interval Training,Cardio,,,,CC-BY-SA 4,"<p>Run and do some interval trainings such as hill repat, fartlek,..</p>"
538,275fb49f-975c-4d6e-9d63-2c86ed740f40,Incline Bench Press - Barbell,Chest,Barbell; Incline bench,Chest,Shoulders; Triceps,CC-BY-SA 3,"<p>To do slowly, tempo is 4010</p>"
527,a48295d8-21da-4625-8a85-331d7ced8d8b,Run,Cardio,,,,CC-BY-SA 4,"<p>Running or jogging outside in a park, on the tracks,...</p>"
539,60e9a0c0-5458-46cd-ab41-7d7b85225cf8,Incline Bench Press - MP,Chest,,Chest,Shoulders; Triceps,CC-BY-SA 3,
500,09349391-375b-42d5-8979-00a5d7196a5b,Reverse Plank,Abs,,,,CC-BY-SA 4,<p>Plank with stomach towards ceiling</p>
562,169896b2-90e3-4497-9d73-56bee4a34697,Shotgun Row,Back,,Lats,,CC-BY-SA 4,"<ol>
<li>Attach a single handle to a low cable.</li>
<li>After selecting the correct weight, stand a couple feet back with a wide-split stance. Your arm should be extended and your shoulder forward. This will be your starting position.</li>
<li>Perform the movement by retracting the shoulder and flexing the elbow. As you pull, supinate the wrist, turning the palm upward as you go.</li>
<li>After a brief pause, return to the starting position.</li>
</ol>"
607,eaf6f39e-d46d-4460-b5a9-71e814b18f89,Splinter Sit-ups,Abs,,Obliquus externus abdominis,,CC-BY-SA 3,"<p>Lie on your back with your legs straight and arms at your sides, keeping your elbows bent at 90 degrees. As you sit up, twist your upper body to the left and bring your left knee toward your right elbow while you swing your left arm back. Lower your body to the starting position, and repeat to your right. That's 1 rep.</p>"
604,b1051c3e-78a9-4b73-899c-c700098cf1a8,Speed Deadlift,Legs,,,,CC-BY-SA 4,<p>Deadlift with short (less than one 1min) rest between sets.</p>
569,141bc870-56be-4749-a3b9-e56d5d5618b4,"Shoulder Press, on Multi Press",Shoulders,,Shoulders,,CC-BY-SA 3,"<p>The exercise is basically the same as with a free barbell:</p>
<p>Sit on a bench, the back rest should be almost vertical. Take a bar with a shoulder wide grip and bring it down to chest height. Press the weight up, but don't stretch the arms completely. Go slowly down and repeat.</p>"
591,f38e9c23-031d-44d0-ac27-7f1026212c73,Sit-ups,Abs,,Abs,,CC-BY-SA 3,"<p>Sit on a mat, your calves are resting on a bench, the knees make a right angle. Hold your hands behind your neck. Go now up with a rolling movement of your back, you should feel how the individual vertebrae lose contact with the mat. At the highest point, contract your abs as much as you can and hold there for 2 sec. Go now down, unrolling your back.</p>
<p> </p>"
906,af0be7c9-2b9d-47fd-abee-84edd8207b9b,Barbell Hip Thrust,Legs,,,,CC-BY-SA 4,"Sit on the ground with a bench behind you, bending your knees so your feet are planted on the ground and holding a barbell resting below your hips. If you have a padded bar, or anything you can slip in between the bar and your body, it will go a long way to making the exercise more comfortable."
920,887fea99-352d-45ff-8e06-ef95eaa37902,V-BAR PULL DOWNS,Back,,Lats,,CC-BY-SA 4,"Cable machine, leaned forward during negative, lean back during contraction"
567,87affa4b-395b-437c-9581-2bd20ea5aa7c,"Shoulder Press, Dumbbells",Shoulders,Dumbbell,Shoulders,,CC-BY-SA 3,"<p>Sit on a bench, the back rest should be almost vertical. Take two dumbbells and bring them up to shoulder height, the palms and the elbows point during the whole exercise to the front. Press the weights up, at the highest point they come very near but don't touch. Go slowly down and repeat.</p>"
566,8b0a0371-c0a9-42a7-aab7-68d520542fb2,"Shoulder Press, Barbell",Shoulders,Barbell,Shoulders,,CC-BY-SA 3,"<p>Sit on a bench, the back rest should be almost vertical. Take a barbell with a shoulder wide grip and bring it up to chest height. Press the weight up, but don't stretch the arms completely. Go slowly down and repeat.</p>"
584,c85e6137-2577-4e28-82c2-427407d534eb,Single-arm Preacher Curl,Arms,Dumbbell,Biceps,,CC-BY-SA 3,"<p>Sit on the preacher curl bench and perform a bicep curl with a dumbbell in one hand. Your other hand can be at rest, or beneath your curling arm's elbow.</p>"
590,6e46833d-fd83-4c1a-90af-eb3f3a917199,Sitting Calf Raises,Calves,,Soleus,Calves,CC-BY-SA 3,"<p>Sit on a bench for calf raises and check that the feet are half free and that you can completely stretch the calf muscles down. Pull your calves up, going as far (up) as you can. Make at the highest point a short pause of 1 or 2 seconds and go down.</p>"
577,cf1f0fed-6310-4210-8f7d-22e375e6c60c,Side Dumbbell Trunk Flexion,Abs,Dumbbell,Obliquus externus abdominis,Abs,CC-BY-SA 3,"<p>AKA dumbbell side bends. Stand in line with the hips with slightly bent knees, maintain the natural curvature of the spine, hand stretched by the body, grip the barbell with one hand. <em> </em>Make slow and controlled torso side flexions till you reach the angle of approximately 45°.</p>"
583,9374fdaf-411f-4ae6-8f0c-21cc2d3dc667,Side to Side Push Ups,Chest,,Shoulders; Obliquus externus abdominis; Chest; Triceps,,CC-BY-SA 4,"<p>-start in push up position</p>
<p>-lean the body weight to the right side, and complete a push up with the chest over the right hand</p>
<p>-come back to the centered position</p>
<p>-on rep 2, lean to the left side</p>"
598,092d0fbb-0409-470e-a087-beb9a378f3f7,Smith Machine Close-grip Bench Press,Arms,,Triceps,Chest,CC-BY-SA 3,"<p>Perform a standard bench press on the smith machine, but have your hands on the bar about shoulder width apart, and keep your elbows close to your body.</p>"
576,2f8ee51b-f493-47f7-8b2a-1da16c128f73,Side Crunch,Abs,Gym mat,Obliquus externus abdominis,Abs,CC-BY-SA 3,<p>Hold weight in one hand. Bend side ways to the knee. Pull upo to upright position using your obliquus.</p>
571,270e108d-3cd2-45a9-807b-c357317eb15c,"Shrugs, Barbells",Shoulders,Barbell,Shoulders,,CC-BY-SA 3,"<p>Take a barbell and stand with a straight body, the arms are hanging freely in front of you. Lift from this position the shoulders as high as you can, but don't bend the arms during the movement. On the highest point, make a short pause of 1 or 2 seconds before returning slowly to the initial position.</p>
<p>When training with a higher weight, make sure that you still do the whole movement!</p>"
578,d9f6c15a-b224-4ef6-93e9-fd6509b66add,Side-lying External Rotation,Shoulders,,,,CC-BY-SA 4,"<p>With a weight in one hand, lie on your side opposite the weight. Keep your knees slightly bent. Hold your elbow against your side, and extend your upper arm straight ahead of you. While continuing to hold your elbow against your side, rotate your upper arm 90 degrees upwards.</p>
<p>It is helpful to place a towel under your armpit to help with the form on this exercise. Placing a support under your head for the duration of the exercise is also a good idea.</p>"
575,6199b3c7-3ccb-47fa-89bb-ef7fef12c0e3,Shrugs on Multipress,Shoulders,,Shoulders,Triceps,CC-BY-SA 3,
572,72a945ec-3a7f-424b-9a05-1616ef7dce91,"Shrugs, Dumbbells",Shoulders,Dumbbell,Shoulders,,CC-BY-SA 3,"<p>Stand with straight body, the hands are hanging freely on the side and hold each a dumbbell. Lift from this position the shoulders as high as you can, but don't bend the arms during the movement. On the highest point, make a short pause of 1 or 2 seconds before returning slowly to the initial position.</p>
<p>When training with a higher weight, make sure that you still do the whole movement!</p>"
595,e60125f0-3a88-4707-815f-fe0e2b4be3c4,Skipping - Standard,Cardio,,Calves,,CC-BY-SA 4,"<p>Do a single, double footed jump for each swing of the rope.</p>
<p>Work on a smooth, rhythmical movement, bouncing lightly on the balls of your feet.</p>"
570,f956977e-cc05-4db2-a387-ba6140b1ef34,Shoulder Shrug,Shoulders,none (bodyweight exercise),Trapezius,,CC0,"The shoulder shrug (usually called simply the shrug) is an exercise in weight training used to develop the upper trapezius muscle. The lifter stands erect, hands about shoulder width apart, and raises the shoulders as high as possible, and then lowers them, while not bending the elbows, or moving the body at all. The lifter may not have as large a range of motion as in a normal shrug done for active flexibility. It is usually considered good form if the slope of the shoulders is horizontal in the elevated position."
580,e1b99153-0102-47fc-b0cd-c21509827b0b,Side Plank,Abs,none (bodyweight exercise),Abs,Obliquus externus abdominis,CC-BY-SA 4,<p>Works your obliques and helps stabilize your spine. Lie on your side and support your body between your forearm and knee to your feet.</p>
556,919bb48a-42fe-4a11-9078-ea2b5087c49f,Side Bends on Machine,Abs,Dumbbell,Obliquus externus abdominis,Abs,CC-BY-SA 3,
628,0f5fc602-afb6-4500-87da-f115f3ef3f47,Straight-arm Pull Down (bar Attachment),Back,,Lats,Triceps,CC-BY-SA 3,"<p>Use the straight bar attachment on a high pulley. Grasp the two ends of the bar with your palms facing downward and your arms straight out in front of you. Pull your hands down towards your hips, while keeping your arms straight, then raise them back up to the starting position.</p>"
632,0a5a7661-1e24-4c15-bb2b-503672141307,Sumo Squats,Legs,none (bodyweight exercise),Glutes; Quads,,CC-BY-SA 4,"<p>Stand with your feet wider than your shoulders, with your toes pointed out at a 45 degree angle and barbell on your shoulder.</p>
<p>While keeping your back straight, descend slowly by bending at the knees and hips as if you are sitting down (squatting).</p>
<p>Lower yourself until your quadriceps and hamstrings are parallel to the floor.</p>
<p>Return to the starting position by pressing upwards and extending your legs while maintaining an equal distribution of weight on your forefoot and heel.</p>"
629,2f7149c3-77ce-4313-a59c-aef82b5a730a,Straight-arm Pull Down (rope Attachment),Back,,Lats,Triceps,CC-BY-SA 3,"<p>Use the rope attachment on a high pulley. Grasp the two ends of the rope with your arms straight out in front of you. Pull your hands down towards your hips, while keeping your arms straight, then raise them back up to the starting position.</p>"
624,4d5decb3-5fbe-45c1-9ad5-ff715e53cb34,Stationary Bike,Cardio,,,,CC-BY-SA 4,<p>Ride a Stationary Bike with various tensions.</p>
630,0c2d9b74-3d1e-481f-a7bf-3b3532f7d6b0,Sumo Deadlift,Legs,,Quads,,CC-BY-SA 4,"<ol>
<li>Begin with a bar loaded on the ground. Approach the bar so that the bar intersects the middle of the feet. The feet should be set very wide, near the collars. Bend at the hips to grip the bar. The arms should be directly below the shoulders, inside the legs, and you can use a pronated grip, a mixed grip, or hook grip. Relax the shoulders, which in effect lengthens your arms.</li>
<li>Take a breath, and then lower your hips, looking forward with your head with your chest up. Drive through the floor, spreading your feet apart, with your weight on the back half of your feet. Extend through the hips and knees.</li>
<li>As the bar passes through the knees, lean back and drive the hips into the bar, pulling your shoulder blades together.</li>
<li>Return the weight to the ground by bending at the hips and controlling the weight on the way down.</li>
</ol>"
616,30ac081b-fb79-4253-9457-8efc07568790,Squat Thrust,Legs,none (bodyweight exercise),Glutes; Quads; Abs; Soleus,,CC0,"The burpee, or squat thrust, is a full body exercise used in strength training and as an aerobic exercise. The basic movement is performed in four steps and known as a four-count burpee: Begin in a standing position. Move into a squat position with your hands on the ground. (count 1) Kick your feet back into a plank position, while keeping your arms extended. (count 2) Immediately return your feet into squat position. (count 3) Stand up from the squat position (count 4)"
627,22c59ede-970b-43e1-bb51-ac1c2be0b0e0,Stiff-legged Deadlifts,Legs,Barbell,Hamstrings,Glutes,CC-BY-SA 3,"<ul>
<li>Keep legs straight</li>
<li>Keep back straight</li>
</ul>"
622,7ce443b6-eb84-4f65-b05f-461c1cc8bcc0,Standing Calf Raises,Calves,,Calves,Soleus,CC-BY-SA 3,"<p>Get onto the calf raises machine, you should able to completely push your calves down. Stand straight, don't make a hollow back and don't bend your legs. Pull yourself up as high as you can. Make a small pause of 1 - 2 seconds and go slowly down.</p>"
614,5c0824dc-f2fb-4d19-a1e5-7c33219ad51d,Squat Jumps,Legs,,Quads,,CC-BY-SA 3,"<p>Jump wide, then close</p>"
